{
  "schema_version": "1.0",
  "inventory_id": "census-government-units-2025:us-hi",
  "generated_at": "2026-08-08T16:21:43Z",
  "sources": [
    {
      "id": "src:census-government-units-2025",
      "title": "2025 Government Units Listing",
      "url": "https://www.census.gov/programs-surveys/gus/technical-documentation/file-layouts/annual-organization-public-use-file.html",
      "kind": "governmental_inventory",
      "accessed_at": "2026-08-08",
      "last_checked_at": "2026-08-08",
      "availability": "available",
      "caveat": "This source establishes government-unit identity, source classification, activity status, and source-provided identifiers. It does not establish building-code adoption, amendment, administration, enforcement authority, or legal boundary geometry."
    }
  ],
  "entities": [
    {
      "schema_version": "1.0",
      "entity_id": "gov:us-hi:consolidated_government:census-government-unit:183701",
      "official_name": "CITY AND COUNTY OF HONOLULU",
      "entity_type": "consolidated_government",
      "state_id": "US-HI",
      "state_fips": "15",
      "identity": {
        "namespace": "census-government-unit",
        "value": "183701"
      },
      "external_identifiers": [
        {
          "scheme": "census-government-unit-pid6",
          "value": "183701"
        },
        {
          "scheme": "government-units-fips-state",
          "value": "15"
        },
        {
          "scheme": "government-units-fips-county",
          "value": "003"
        },
        {
          "scheme": "government-units-fips-place",
          "value": "17000"
        }
      ],
      "legal_status": "active",
      "effective_interval": {},
      "classification": "unresolved",
      "historical_geography_status": "unavailable",
      "population": {
        "count": 989408,
        "source_year": "2023"
      },
      "source_classifications": [
        {
          "system": "census-government-units-2025",
          "unit_type": "2 - MUNICIPAL",
          "political_code_description": "CITY AND COUNTY"
        }
      ],
      "source_ids": [
        "src:census-government-units-2025"
      ]
    },
    {
      "schema_version": "1.0",
      "entity_id": "gov:us-hi:county_equivalent:census-government-unit:162013",
      "official_name": "COUNTY OF KAUAI",
      "entity_type": "county_equivalent",
      "state_id": "US-HI",
      "state_fips": "15",
      "identity": {
        "namespace": "census-government-unit",
        "value": "162013"
      },
      "external_identifiers": [
        {
          "scheme": "census-government-unit-pid6",
          "value": "162013"
        },
        {
          "scheme": "government-units-fips-state",
          "value": "15"
        },
        {
          "scheme": "government-units-fips-county",
          "value": "007"
        },
        {
          "scheme": "government-units-fips-place",
          "value": "99007"
        }
      ],
      "legal_status": "active",
      "effective_interval": {},
      "classification": "unresolved",
      "historical_geography_status": "unavailable",
      "population": {
        "count": 73851,
        "source_year": "2023"
      },
      "source_classifications": [
        {
          "system": "census-government-units-2025",
          "unit_type": "1 - COUNTY",
          "political_code_description": "COUNTY"
        }
      ],
      "source_ids": [
        "src:census-government-units-2025"
      ]
    },
    {
      "schema_version": "1.0",
      "entity_id": "gov:us-hi:county_equivalent:census-government-unit:184856",
      "official_name": "COUNTY OF HAWAII",
      "entity_type": "county_equivalent",
      "state_id": "US-HI",
      "state_fips": "15",
      "identity": {
        "namespace": "census-government-unit",
        "value": "184856"
      },
      "external_identifiers": [
        {
          "scheme": "census-government-unit-pid6",
          "value": "184856"
        },
        {
          "scheme": "government-units-fips-state",
          "value": "15"
        },
        {
          "scheme": "government-units-fips-county",
          "value": "001"
        },
        {
          "scheme": "government-units-fips-place",
          "value": "99001"
        }
      ],
      "legal_status": "active",
      "effective_interval": {},
      "classification": "unresolved",
      "historical_geography_status": "unavailable",
      "population": {
        "count": 207615,
        "source_year": "2023"
      },
      "source_classifications": [
        {
          "system": "census-government-units-2025",
          "unit_type": "1 - COUNTY",
          "political_code_description": "COUNTY"
        }
      ],
      "source_ids": [
        "src:census-government-units-2025"
      ]
    },
    {
      "schema_version": "1.0",
      "entity_id": "gov:us-hi:county_equivalent:census-government-unit:189877",
      "official_name": "COUNTY OF MAUI",
      "entity_type": "county_equivalent",
      "state_id": "US-HI",
      "state_fips": "15",
      "identity": {
        "namespace": "census-government-unit",
        "value": "189877"
      },
      "external_identifiers": [
        {
          "scheme": "census-government-unit-pid6",
          "value": "189877"
        },
        {
          "scheme": "government-units-fips-state",
          "value": "15"
        },
        {
          "scheme": "government-units-fips-county",
          "value": "009"
        },
        {
          "scheme": "government-units-fips-place",
          "value": "99009"
        }
      ],
      "legal_status": "active",
      "effective_interval": {},
      "classification": "unresolved",
      "historical_geography_status": "unavailable",
      "population": {
        "count": 164183,
        "source_year": "2023"
      },
      "source_classifications": [
        {
          "system": "census-government-units-2025",
          "unit_type": "1 - COUNTY",
          "political_code_description": "COUNTY"
        }
      ],
      "source_ids": [
        "src:census-government-units-2025"
      ]
    }
  ]
}
